{
  "investigation_id": "11111111-1111-4111-8111-111111111111",
  "created_at": "2026-08-01T14:00:00Z",
  "metric": "revenue",
  "grain": "hour",
  "target_window": { "start": "2026-07-04T10:00:00Z", "end": "2026-07-04T11:00:00Z" },
  "baseline_window": {
    "method": "same_weekday_trailing_weeks",
    "description": "same weekday (Sat) + hour-of-day (10:00), median over trailing 3 weeks",
    "weeks": 3
  },
  "anomaly": {
    "detected": true,
    "observed": 76421.0,
    "expected": 90120.0,
    "abs_delta": -13699.0,
    "pct_delta": -0.152,
    "score": 4.7,
    "direction": "drop"
  },
  "factor_decomposition": {
    "method": "log_additive",
    "primary_factor": "fill_rate",
    "factors": [
      { "factor": "requests", "contribution_pct": 0.05, "from": 5120000, "to": 5098000 },
      { "factor": "fill_rate", "contribution_pct": 0.88, "from": 0.82, "to": 0.61 },
      { "factor": "ecpm", "contribution_pct": 0.07, "from": 3.14, "to": 3.09 }
    ]
  },
  "drilldown": [
    {
      "depth": 1,
      "split_dimension": "country",
      "segment": { "country": "IN" },
      "metric_from": 0.83,
      "metric_to": 0.55,
      "contribution_pct": 0.63,
      "status": "culprit",
      "query_id": "q_10"
    },
    {
      "depth": 2,
      "split_dimension": "os_version",
      "segment": { "country": "IN", "os_version": "Android 13" },
      "metric_from": 0.84,
      "metric_to": 0.42,
      "contribution_pct": 0.71,
      "status": "culprit",
      "query_id": "q_14"
    },
    {
      "depth": 3,
      "split_dimension": "app_id",
      "segment": { "country": "IN", "os_version": "Android 13", "app_id": "app_00123" },
      "metric_from": 0.85,
      "metric_to": 0.31,
      "contribution_pct": 0.68,
      "status": "culprit",
      "query_id": "q_19"
    }
  ],
  "localized_segment": { "country": "IN", "os_version": "Android 13", "app_id": "app_00123" },
  "ruled_out": [
    { "hypothesis": "request_volume", "evidence": "requests within 0.4% of baseline (+0.2 sigma)", "query_id": "q_03" },
    { "hypothesis": "ctr_quality", "evidence": "CTR 2.05% vs 2.01% baseline (+0.3 sigma)", "query_id": "q_05" },
    { "hypothesis": "ecpm_price", "evidence": "eCPM 3.09 vs 3.14 baseline (-1.6%, not primary)", "query_id": "q_07" },
    { "hypothesis": "seasonality", "evidence": "same-weekday/hour baseline applied; residual -15.2% remains after seasonality", "query_id": "q_02" }
  ],
  "queries": [
    {
      "id": "q_02",
      "sql": "SELECT quantileExact(0.5)(revenue_hourly) FROM hourly_summary WHERE toDayOfWeek(hour)=6 AND toHour(hour)=10 AND hour < {target_start:DateTime}",
      "result_summary": { "baseline_revenue": 90120.0 }
    },
    {
      "id": "q_03",
      "sql": "SELECT sum(requests) FROM hourly_summary WHERE hour BETWEEN {target_start:DateTime} AND {target_end:DateTime}",
      "result_summary": { "requests": 5098000 }
    },
    {
      "id": "q_10",
      "sql": "SELECT country, (sum(is_filled)/count(*)) AS fill_rate FROM events_full WHERE hour BETWEEN {target_start:DateTime} AND {target_end:DateTime} GROUP BY country ORDER BY (baseline_fill - fill_rate) DESC",
      "result_summary": { "top": { "country": "IN", "fill_rate": 0.55 } }
    }
  ],
  "narrative": "Revenue fell 15.2% (76,421 vs an expected 90,120 for this Saturday hour). The drop is almost entirely a fill-rate collapse — fill rate fell from 82% to 61%, accounting for ~88% of the move, while request volume and eCPM were flat. Drilling in, the loss localizes to India on Android 13 in app_00123, where fill rate cratered from 85% to 31%. Request volume (+0.2 sigma), CTR (2.05% vs 2.01%), and seasonality were checked and ruled out.",
  "narrative_verification": { "passed": true, "unverified_numbers": [] },
  "trace_url": "https://cloud.langfuse.com/project/demo/traces/11111111-1111-4111-8111-111111111111"
}
